{
  "schemaVersion": 1,
  "userId": "nina-meera-patel",
  "corpusId": "realistic",
  "forms": [
    "i-9"
  ],
  "purpose": "Committed deterministic 100-document realistic corpus for exercising high-volume I-9 fixture generation and validation without live AI calls.",
  "targetDocumentCount": 100,
  "categoryCounts": {
    "address-contact": 15,
    "employer-context": 8,
    "hr-onboarding": 12,
    "identity": 15,
    "noise": 20,
    "partial-conflicting": 18,
    "work-authorization": 12
  },
  "challengeTags": [
    "alias-name",
    "citizen-work-authorization",
    "email-vs-work-email",
    "intentionally-missing-phone",
    "stale-address",
    "partial-or-conflicting",
    "noise",
    "intentionally-missing-work-auth-numbers",
    "work-email-vs-personal-email",
    "employer-context-not-identity-authority"
  ],
  "intentionallyMissing": [
    {
      "factKey": "contact.phone",
      "forms": [
        "i-9"
      ],
      "reason": "Nina does not provide a phone number in the committed fixture.",
      "expectedBehavior": "Leave the telephone field blank; do not guess or synthesize a phone number."
    },
    {
      "factKey": "workAuthorization.uscisANumber",
      "forms": [
        "i-9"
      ],
      "reason": "Nina uses the U.S. citizen I-9 path, so no USCIS A-number applies.",
      "expectedBehavior": "Leave the alien registration number field blank for this fixture."
    },
    {
      "factKey": "workAuthorization.i94AdmissionNumber",
      "forms": [
        "i-9"
      ],
      "reason": "Nina uses the U.S. citizen I-9 path, so no I-94 number applies.",
      "expectedBehavior": "Leave the I-94 admission number field blank for this fixture."
    },
    {
      "factKey": "workAuthorization.foreignPassportNumber",
      "forms": [
        "i-9"
      ],
      "reason": "Nina uses the U.S. citizen I-9 path, so no foreign passport number applies.",
      "expectedBehavior": "Leave the foreign passport number field blank for this fixture."
    }
  ],
  "documents": [
    {
      "id": "nina-meera-patel-realistic-001",
      "path": "documents/identity/001-driver-license-transcript.md",
      "category": "identity",
      "title": "Driver License Transcript",
      "factKeys": [
        "identity.legalName",
        "identity.dateOfBirth",
        "address.current.street",
        "address.current.unit",
        "address.current.city",
        "address.current.state",
        "address.current.postalCode"
      ],
      "detailTier": "hero",
      "authority": "high",
      "freshness": "current",
      "expectedUse": "extract",
      "challengeTags": [],
      "outputExtension": "md",
      "brief": "Driver License Transcript: Return natural Markdown-compatible text, but avoid a generic field/value template unless the source document requires it. Write it as identity evidence with authority high, freshness current, and expected use extract. Naturally include only these supported current fact keys: identity.legalName, identity.dateOfBirth, address.current.street, address.current.unit, address.current.city, address.current.state, address.current.postalCode. Do not invent missing values (contact.phone, workAuthorization.uscisANumber, workAuthorization.i94AdmissionNumber, workAuthorization.foreignPassportNumber). Avoid unrelated sensitive facts (identity.ssn, contact.email, employment.workEmail) unless listed above. Make this current enough to extract from, with realistic source headers, dates, labels, omissions, or export artifacts.",
      "forbiddenFactKeys": [
        "identity.ssn",
        "contact.email",
        "employment.workEmail",
        "contact.phone",
        "workAuthorization.uscisANumber",
        "workAuthorization.i94AdmissionNumber",
        "workAuthorization.foreignPassportNumber"
      ]
    },
    {
      "id": "nina-meera-patel-realistic-002",
      "path": "documents/identity/002-state-id-renewal-note.md",
      "category": "identity",
      "title": "State ID Renewal Note",
      "factKeys": [
        "identity.legalName",
        "identity.dateOfBirth",
        "identity.middleInitial",
        "address.current.street",
        "address.current.city",
        "address.current.state",
        "address.current.postalCode"
      ],
      "detailTier": "hero",
      "authority": "high",
      "freshness": "current",
      "expectedUse": "extract",
      "challengeTags": [],
      "outputExtension": "md",
      "brief": "State ID Renewal Note: Return natural Markdown-compatible text, but avoid a generic field/value template unless the source document requires it. Write it as identity evidence with authority high, freshness current, and expected use extract. Naturally include only these supported current fact keys: identity.legalName, identity.dateOfBirth, identity.middleInitial, address.current.street, address.current.city, address.current.state, address.current.postalCode. Do not invent missing values (contact.phone, workAuthorization.uscisANumber, workAuthorization.i94AdmissionNumber, workAuthorization.foreignPassportNumber). Avoid unrelated sensitive facts (identity.ssn, contact.email, employment.workEmail) unless listed above. Make this current enough to extract from, with realistic source headers, dates, labels, omissions, or export artifacts.",
      "forbiddenFactKeys": [
        "identity.ssn",
        "contact.email",
        "employment.workEmail",
        "contact.phone",
        "workAuthorization.uscisANumber",
        "workAuthorization.i94AdmissionNumber",
        "workAuthorization.foreignPassportNumber"
      ]
    },
    {
      "id": "nina-meera-patel-realistic-003",
      "path": "documents/identity/003-passport-application-draft.md",
      "category": "identity",
      "title": "Passport Application Draft",
      "factKeys": [
        "identity.legalName",
        "identity.dateOfBirth",
        "contact.email",
        "workAuthorization.citizenshipStatus"
      ],
      "detailTier": "hero",
      "authority": "high",
      "freshness": "current",
      "expectedUse": "extract",
      "challengeTags": [],
      "outputExtension": "md",
      "brief": "Passport Application Draft: Return natural Markdown-compatible text, but avoid a generic field/value template unless the source document requires it. Write it as identity evidence with authority high, freshness current, and expected use extract. Naturally include only these supported current fact keys: identity.legalName, identity.dateOfBirth, contact.email, workAuthorization.citizenshipStatus. Do not invent missing values (contact.phone, workAuthorization.uscisANumber, workAuthorization.i94AdmissionNumber, workAuthorization.foreignPassportNumber). Avoid unrelated sensitive facts (identity.ssn, employment.workEmail) unless listed above. Make this current enough to extract from, with realistic source headers, dates, labels, omissions, or export artifacts.",
      "forbiddenFactKeys": [
        "identity.ssn",
        "employment.workEmail",
        "contact.phone",
        "workAuthorization.uscisANumber",
        "workAuthorization.i94AdmissionNumber",
        "workAuthorization.foreignPassportNumber"
      ]
    },
    {
      "id": "nina-meera-patel-realistic-004",
      "path": "documents/identity/004-birth-record-summary.md",
      "category": "identity",
      "title": "Birth Record Summary",
      "factKeys": [
        "identity.legalName",
        "identity.dateOfBirth",
        "workAuthorization.citizenshipStatus"
      ],
      "detailTier": "hero",
      "authority": "high",
      "freshness": "current",
      "expectedUse": "extract",
      "challengeTags": [],
      "outputExtension": "md",
      "brief": "Birth Record Summary: Return natural Markdown-compatible text, but avoid a generic field/value template unless the source document requires it. Write it as identity evidence with authority high, freshness current, and expected use extract. Naturally include only these supported current fact keys: identity.legalName, identity.dateOfBirth, workAuthorization.citizenshipStatus. Do not invent missing values (contact.phone, workAuthorization.uscisANumber, workAuthorization.i94AdmissionNumber, workAuthorization.foreignPassportNumber). Avoid unrelated sensitive facts (identity.ssn, contact.email, employment.workEmail) unless listed above. Make this current enough to extract from, with realistic source headers, dates, labels, omissions, or export artifacts.",
      "forbiddenFactKeys": [
        "identity.ssn",
        "contact.email",
        "employment.workEmail",
        "contact.phone",
        "workAuthorization.uscisANumber",
        "workAuthorization.i94AdmissionNumber",
        "workAuthorization.foreignPassportNumber"
      ]
    },
    {
      "id": "nina-meera-patel-realistic-005",
      "path": "documents/identity/005-name-history-declaration.md",
      "category": "identity",
      "title": "Name History Declaration",
      "factKeys": [
        "identity.legalName",
        "identity.otherLastNames",
        "identity.middleInitial"
      ],
      "detailTier": "medium",
      "authority": "high",
      "freshness": "current",
      "expectedUse": "extract",
      "challengeTags": [
        "alias-name"
      ],
      "outputExtension": "md",